{
  "kind": "yohaku.receipt-bundle",
  "version": 1,
  "bundle_id": "00000000-0000-4000-8000-000000000006",
  "book_id": "00000000-0000-4000-8000-000000000002",
  "part": 1,
  "parts": 1,
  "records": [
    {
      "record_id": "00000000-0000-4000-8000-000000000007",
      "receipt_id": "00000000-0000-4000-8000-000000000008",
      "record_revision": 1,
      "receipt_revision": 1,
      "date": "2026-10-04",
      "merchant": "スーパー",
      "original": {
        "currency": "JPY",
        "amount": "1200"
      },
      "settlement": {
        "currency": "JPY",
        "amount": "1200"
      },
      "images": [
        {
          "image_id": "00000000-0000-4000-8000-000000000009",
          "position": 0,
          "path": "images/00000000-0000-4000-8000-000000000008/00000000-0000-4000-8000-000000000009",
          "sha256": "0000000000000000000000000000000000000000000000000000000000000000",
          "mime_type": "image/jpeg",
          "size_bytes": 1234
        }
      ]
    }
  ]
}
